{
  "target_version": "21.0.3",
  "upgrade_mode": "in_place",
  "installers": {
    "21.0.3": {
      "windows": "https://example.invalid/installers/fms_Setup_21.0.3.exe",
      "macos": "https://example.invalid/installers/fms_Setup_21.0.3.pkg",
      "linux": "https://example.invalid/installers/fms_Setup_21.0.3.rpm",
      "sha256": "0123456789abcdef0123456789abcdef0123456789abcdef0123456789abcdef"
    },
    "21.0.2": {
      "windows": "https://example.invalid/installers/fms_Setup_21.0.2.exe",
      "macos": "https://example.invalid/installers/fms_Setup_21.0.2.pkg",
      "linux": "https://example.invalid/installers/fms_Setup_21.0.2.rpm",
      "sha256": "fedcba9876543210fedcba9876543210fedcba9876543210fedcba9876543210"
    }
  },
  "fms": {
    "install_root_windows": "C:\\Program Files\\FileMaker\\FileMaker Server",
    "admin_port": 16001,
    "creds_file": "C:\\chrysalis\\creds.xml"
  },
  "backup_root": "C:\\FMS_Backups",
  "max_backup_age_hours": 24,
  "shutdown_sequence": [
    "FMSTB",
    "FMSE",
    "XDBC",
    "WPE",
    "FMDAPI",
    "ADMINSERVER",
    "SERVER"
  ],
  "startup_sequence": [
    "SERVER",
    "ADMINSERVER",
    "FMSE",
    "XDBC",
    "WPE",
    "FMDAPI",
    "FMSTB"
  ]
}
