{
  "target_version": "21.0.3",
  "installers": {
    "21.0.2": {
      "windows": "https://example.invalid/installers/fms_21.0.2.exe",
      "macos": "https://example.invalid/installers/fms_21.0.2.pkg",
      "linux": "https://example.invalid/installers/fms_21.0.2.rpm",
      "sha256": "fedcba9876543210fedcba9876543210fedcba9876543210fedcba9876543210"
    }
  },
  "fms": {
    "install_root_windows": "C:\\Program Files\\FileMaker\\FileMaker Server",
    "admin_port": 16001,
    "creds_file": "C:\\chrysalis\\creds.xml"
  },
  "backup_root": "C:\\FMS_Backups",
  "shutdown_sequence": ["SERVER"],
  "startup_sequence": ["SERVER"]
}
